{
  "specversion": "1.0",
  "id": "11111111-1111-4111-8111-111111111111",
  "source": "https://omama.vn/services/order-service",
  "type": "vn.omama.order.completed.v3",
  "subject": "order:11111111-1111-4111-8111-111111111111",
  "time": "2026-10-15T03:00:00Z",
  "datacontenttype": "application/json",
  "data": {
    "aggregate_id": "11111111-1111-4111-8111-111111111111",
    "version": 2,
    "ordinal": 0,
    "status": "COMPLETED",
    "payment_status": "CONFIRMED",
    "stock_status": "COMMITTED",
    "completion_decision_id": "care-decision-1"
  }
}
